{
  "$schema": "./references.schema.json",
  "version": 1,
  "lastReviewed": "2026-08-11",
  "purpose": "External standards and primary-source references VibeCode QA should cite when authoring stack-specific gold-standard KBs. This registry is not the VCQA rubric itself; it is the authority map for where each rubric should look first.",
  "policy": {
    "sourcePreference": [
      "Official specification",
      "Official project or vendor documentation",
      "Recognized independent standard body",
      "Mature ecosystem documentation",
      "Vendor-neutral implementation guide"
    ],
    "authoringRule": "VCQA standards should compose and cite these sources. Do not re-create broad framework doctrine when an upstream standard already exists; author only the stack shape, deployment constraints, detection mapping, exceptions, and anti-patterns needed to judge a repo.",
    "linkHealth": {
      "status": "checked-in-ci",
      "rule": "Every primary-source URL must return 2xx. Redirects fail unless expectedRedirectUrl is recorded on the reference.",
      "transientRule": "A definitive answer we do not want - 4xx, 5xx, an unexpected redirect, a dead hostname, a refused connection, an invalid certificate - is a registry defect and fails the build. A connection that times out or is reset is not an answer at all: it is retried up to three times, and if it still will not answer it is reported as a warning and the build proceeds, because third-party availability is not a property of our commit. Past three unreachable references the run fails instead - that is an outage rather than a flake, and link health has not actually been verified. Run validate-references.mjs --links-strict to make every unreachable reference fatal.",
      "versioningRule": "Where a publisher versions its documentation by date or release, cite the pinned upstream URL and state the edition in versionPolicy. An undated URL that redirects to whatever snapshot is current breaks CI on the publisher's next release, so expectedRedirectUrl is reserved for stable one-off redirects with no pinnable equivalent. A pinned citation ages deliberately and is refreshed on review, which is the intended behaviour for a standards registry."
    },
    "appliesToRule": "appliesTo contains only canonical VCQA standard or stack item IDs from registry.json/compositions.json. Descriptive discovery terms live in topics."
  },
  "categories": [
    {
      "id": "web-platform",
      "title": "Web platform",
      "description": "Baseline browser, markup, accessibility, and web API references.",
      "references": [
        {
          "id": "html-living-standard",
          "title": "HTML Living Standard",
          "publisher": "WHATWG",
          "url": "https://html.spec.whatwg.org/",
          "appliesTo": [],
          "useFor": [
            "HTML semantics",
            "forms",
            "navigation",
            "browser integration"
          ],
          "topics": [
            "html",
            "browser-app",
            "static-site",
            "spa",
            "ssr"
          ]
        },
        {
          "id": "wcag-22",
          "title": "Web Content Accessibility Guidelines (WCAG) 2.2",
          "publisher": "W3C WAI",
          "url": "https://www.w3.org/TR/WCAG22/",
          "appliesTo": [
            "docs-kb"
          ],
          "useFor": [
            "Accessibility conformance",
            "perceivable/operable/understandable/robust criteria"
          ],
          "topics": [
            "ui",
            "website",
            "web-app",
            "documentation-site"
          ]
        },
        {
          "id": "wai-aria",
          "title": "WAI-ARIA Authoring Practices Guide",
          "publisher": "W3C WAI",
          "url": "https://www.w3.org/WAI/ARIA/apg/",
          "appliesTo": [],
          "useFor": [
            "ARIA widget patterns",
            "keyboard interaction",
            "focus behavior"
          ],
          "topics": [
            "ui",
            "component-library",
            "web-app"
          ]
        },
        {
          "id": "mdn-web-docs",
          "title": "MDN Web Docs",
          "publisher": "Mozilla",
          "url": "https://developer.mozilla.org/en-US/docs/Web",
          "appliesTo": [],
          "useFor": [
            "Browser API behavior",
            "compatibility",
            "web platform explanations"
          ],
          "topics": [
            "browser-app",
            "javascript",
            "css",
            "html"
          ]
        }
      ]
    },
    {
      "id": "languages-runtimes",
      "title": "Languages and runtimes",
      "description": "Language, runtime, package manager, and CLI baseline references.",
      "references": [
        {
          "id": "typescript-tsconfig",
          "title": "TSConfig Reference",
          "publisher": "TypeScript",
          "url": "https://www.typescriptlang.org/tsconfig/",
          "appliesTo": [
            "typescript"
          ],
          "useFor": [
            "Strictness flags",
            "module resolution",
            "project references"
          ],
          "topics": [
            "tsconfig",
            "strict-types"
          ]
        },
        {
          "id": "typescript-handbook",
          "title": "TypeScript Handbook",
          "publisher": "TypeScript",
          "url": "https://www.typescriptlang.org/docs/handbook/intro.html",
          "appliesTo": [
            "typescript",
            "typescript-sdk"
          ],
          "useFor": [
            "Type modeling",
            "narrowing",
            "generics",
            "declaration files"
          ],
          "topics": [
            "library",
            "sdk",
            "app"
          ]
        },
        {
          "id": "node-docs",
          "title": "Node.js Documentation",
          "publisher": "OpenJS Foundation",
          "url": "https://nodejs.org/docs/latest/api/",
          "appliesTo": [
            "node-cli-internal-tool",
            "typescript-sdk"
          ],
          "useFor": [
            "Runtime APIs",
            "process behavior",
            "streams",
            "crypto",
            "file system"
          ],
          "topics": [
            "node-service",
            "node-cli",
            "node-library"
          ]
        },
        {
          "id": "node-security-best-practices",
          "title": "Node.js Security Best Practices",
          "publisher": "OpenJS Foundation",
          "url": "https://nodejs.org/learn/getting-started/security-best-practices",
          "appliesTo": [
            "node-cli-internal-tool"
          ],
          "useFor": [
            "Node runtime security posture",
            "dependency and input handling guidance"
          ],
          "topics": [
            "node-service",
            "node-cli",
            "server-side-javascript"
          ]
        },
        {
          "id": "npm-package-json",
          "title": "package.json",
          "publisher": "npm",
          "url": "https://docs.npmjs.com/cli/v11/configuring-npm/package-json/",
          "appliesTo": [],
          "useFor": [
            "Package metadata",
            "bin",
            "exports",
            "files",
            "scripts",
            "engines"
          ],
          "topics": [
            "npm-package",
            "library",
            "cli",
            "workspace"
          ]
        },
        {
          "id": "pnpm-workspaces",
          "title": "pnpm Workspaces",
          "publisher": "pnpm",
          "url": "https://pnpm.io/workspaces",
          "appliesTo": [],
          "useFor": [
            "Workspace layout",
            "workspace protocol",
            "recursive scripts"
          ],
          "topics": [
            "monorepo",
            "workspace",
            "typescript-project-references"
          ]
        },
        {
          "id": "dart-effective",
          "title": "Effective Dart",
          "publisher": "Dart",
          "url": "https://dart.dev/effective-dart",
          "appliesTo": [
            "dart"
          ],
          "useFor": [
            "Dart style",
            "documentation",
            "usage and design guidance"
          ],
          "topics": [
            "flutter"
          ]
        },
        {
          "id": "melos-docs",
          "title": "Melos Documentation",
          "publisher": "Invertase",
          "url": "https://melos.invertase.dev/",
          "appliesTo": [
            "melos"
          ],
          "useFor": [
            "Dart and Flutter monorepo package orchestration",
            "bootstrap scripts",
            "workspace analyze/test commands"
          ],
          "topics": [
            "dart-workspace",
            "flutter-workspace",
            "monorepo"
          ]
        }
      ]
    },
    {
      "id": "frontend-frameworks",
      "title": "Frontend frameworks and build tools",
      "description": "Framework authorities to reference from stack-specific UI standards.",
      "references": [
        {
          "id": "react-docs",
          "title": "React Documentation",
          "publisher": "Meta / React",
          "url": "https://react.dev/",
          "appliesTo": [
            "react",
            "react-spa",
            "react-ssr"
          ],
          "useFor": [
            "Components",
            "hooks",
            "state",
            "effects",
            "React compiler guidance"
          ],
          "topics": []
        },
        {
          "id": "react-rules-of-hooks",
          "title": "Rules of Hooks",
          "publisher": "React",
          "url": "https://react.dev/reference/rules/rules-of-hooks",
          "appliesTo": [
            "react"
          ],
          "useFor": [
            "Hook call placement",
            "custom hook constraints",
            "lint mapping"
          ],